{
  "schema_version":1,"id":"linux.synchronization.rcu.book","title":"RCU：从旧读者边界到安全回收","version":"1.0.0","status":"evolving","outline_file":"outline.md",
  "chapters":[
    {"id":"linux.rcu.chapter.old_reader","title":"入口更新后旧对象为什么仍不能释放","objective":"区分共享入口可见性和读者已保存地址的生命期。","file":"chapters/P01_old_reader.md","estimated_minutes":12,"prerequisites":[],"claim_ids":["linux.rcu.claim.entry_update_not_reclaim"],"knowledge_refs":["knowledge.linux.synchronization.rcu.why_rcu"]},
    {"id":"linux.rcu.chapter.grace_period","title":"宽限期究竟等待谁","objective":"建立有边界的旧读者集合模型。","file":"chapters/P02_grace_period.md","estimated_minutes":13,"prerequisites":["linux.rcu.chapter.old_reader"],"claim_ids":["linux.rcu.claim.grace_period_bounds_old_readers"],"knowledge_refs":["knowledge.linux.synchronization.rcu.abstract_model"]},
    {"id":"linux.rcu.chapter.cost","title":"读侧成本转移到了哪里","objective":"理解发布、等待、回调、写者串行化和对象逃逸责任。","file":"chapters/P03_cost_and_lifetime.md","estimated_minutes":14,"prerequisites":["linux.rcu.chapter.grace_period"],"claim_ids":["linux.rcu.claim.cost_moves_to_update"],"knowledge_refs":["knowledge.linux.synchronization.rcu.abstract_model","knowledge.linux.synchronization.rcu.constraints"]},
    {"id":"linux.rcu.chapter.tree","title":"Tree RCU 怎样汇聚完成证据","objective":"理解局部证据、层次汇聚、抢占登记和异常慢路径。","file":"chapters/P04_tree_rcu.md","estimated_minutes":16,"prerequisites":["linux.rcu.chapter.cost"],"claim_ids":["linux.rcu.claim.tree_aggregates_evidence"],"knowledge_refs":["knowledge.linux.synchronization.rcu.tree_state"]}
  ],
  "knowledge":{"claims_file":"knowledge/claims.json","relations_file":"knowledge/relations.json","source_map_file":"knowledge/source_map.json"},
  "training_plan":"training/plan.json"
}
